bills_included,description,details_url,first_published_date,floor_plan,furnished_state,latitude,listing_id,longitude,num_bathrooms,num_bedrooms,num_recepts,outcode,property_type,rent_price,shared_occu,student,rented,room_pm
0.0,"To book a viewing please visit our website  or if you have an iPhone device download the 'Bunk' app and arrange a viewing through there.Bunk is pleased to offer this spacious five double bedroom and two bathroom terraced house. This student property is available to rent for a minimum of 12 months, beginning 30th June 2020.The property is fully furnished, complete with lounge, equipped kitchen with storage space and access to a private patio garden.It is ideally situated for students with its close proximity to Gloucester Road and Filton Avenue, neighbouring a large public park. Just a 4 minute walk away from bus stops connecting to uwe and University of Bristol and City Centre.To book a viewing please visit our website  or if you have an iPhone device download the 'Bunk' app and arrange a viewing through there.",https://www.zoopla.co.uk/to-rent/details/53324647?utm_source=v1:5rrMAiKeXRaB5B66ZOF-pGGnegU4wb2L&utm_medium=api,2019-11-13 17:45:59,0,furnished,51.48376,53324647,-2.591766,2,5,1,BS7,Terrace,2375,0,1,1,475.0
0.0,"Upon entering the property you are greeted by a spacious hallway which leads onto a two bay fronted double bedroom. Further along there is a large living area which looks onto the garden beyond. Adjoining the living room is the stunning kitchen which features stylish modern units. On the first floor there are three further light filled double bedrooms and a bathroom with a white three piece suite, chrome mixer taps and a towel rail.Situated to the north of the city, Filton is an ideal area for many types of residents. The area is particularly suited to students with the University of the West of England Frenchay campus close by. Filton also benefits from an abundance of amenities with many eateries, shops and bars in the area. Additionally, with the city centre located a short distance away, residents can access the wider range of facilities available in the heart of Bristol including the Bristol Shopping Quarter. Filton also boasts great transport links with regular bus services in operation as well as Filton Abbey Wood rail station being within the area.If you are not able to attend a viewing, Grant Property offer live interactive viewings through Skype, Facetime, Whatsapp Video etc to offer flexibility for you to view and secure a property with us.Managed by ARLA registered agent Grant Property which has a 24-hour emergency repairs service.EPC rating: C. Landlord Registration Number: Exempt from lr in England. Letting Agent Registration Number: 1903114.",https://www.zoopla.co.uk/to-rent/details/53713974?utm_source=v1:5rrMAiKeXRaB5B66ZOF-pGGnegU4wb2L&utm_medium=api,2019-12-13 12:27:50,0,furnished,51.493507,53713974,-2.5755,1,4,0,BS7,Semi-detached house,2360,0,1,0,590.0
0.0,"***student property*** internet included***Five bedroom student house on Rudthorpe Road in Horfield, offered fully furnished and available from the 5th of July 2019.The house is over three floors and is in a prime location just off Gloucester Road. It offers easy access to the many amenities of Gloucester Road and public transport links to uwe, the City Centre and The Mall Cribbs Causeway.The property briefly comprises of a large living room at the front of the property that is furnished with sofas, a large fitted kitchen at the rear that comes with white goods, five bedrooms with double beds that are furnished as study rooms, a clean bathroom with a shower over the bath and an attractive back garden.The property also benefits from double glazing, gas central heating and a free gardener.What you will like:- Great location for access to uwe- Just off Gloucester Road- Bedrooms recently refurbished- Close to amenities- Five double beds- Internet included within the rent- Large garden- Tumble dryer included- A gardener that maintains the gardenwhat you may not like:- This property is only available to students- Tenants with pets will not be considered with this house",https://www.zoopla.co.uk/to-rent/details/49620753?utm_source=v1:5rrMAiKeXRaB5B66ZOF-pGGnegU4wb2L&utm_medium=api,2018-11-05 17:58:02,0,furnished,51.485123,49620753,-2.5839630000000002,1,5,1,BS7,Terrace,2346,0,1,1,469.0
0.0,"***student property*** Large five double bedroom student house on Brynland Avenue in Bishopston, offered fully furnished and available from the 15th of July 2019.The house is on Brynland Avenue which runs parallel to Gloucester Road. Because of the location it is very easy to get to amenities and public transport links to the City Centre and uwe. It is also a short walk from St Andrews Park.The accommodation briefly comprises of a spacious living room furnished with leather sofas, a fitted kitchen with white goods and gas hobs, five good sized double bedrooms which are furnished as study rooms, a clean bathroom with a shower over the bath and a low maintenance back garden.The property also benefits from double glazing, gas central heating and a combination boiler.What you will like:- Sought after location, - Good access to Gloucester Road and amenities, - Close to public transport links to the City Centre, - Five double bedrooms, - Back garden.What you may not like:- This house is only available to students, - Tenants with pets will not be considered with this property.",https://www.zoopla.co.uk/to-rent/details/49620750?utm_source=v1:5rrMAiKeXRaB5B66ZOF-pGGnegU4wb2L&utm_medium=api,2018-11-06 19:05:42,0,furnished,51.48188,49620750,-2.5849450000000003,1,5,1,BS7,Terrace,2325,0,1,1,465.0
0.0,"This spacious terraced property located in the popular area of Filton in Bristol. This property benefits from being in close proximity to a number of large employers and uwe University, in addition to having great transport links by motorway, bus and train.Upon entering the property you are presented with a bright and spacious hallway which leads onto light filled bay fronted double bedroom. To the rear of the property is the open plan living area which adjoins onto the modern kitchen boasting views of the expansive garden.To the first floor are the further three generously sized double bedrooms which all benefit from large windows and the three-piece family bathroom complete with power shower, heated towel rail and chrome detailingAdditional features includes; Free on street parking, large private garden, original features such as fireplaces and stained glassSituated to the north of the city, Filton is an ideal area for many types of residents. The area is particularly suited to students with the University of the West of England Frenchay campus close by. Filton also benefits from an abundance of amenities with many eateries, shops and bars in the area. Additionally, with the city centre located a short distance away, residents can access the wider range of facilities available in the heart of Bristol including the Bristol Shopping Quarter. Filton also boasts great transport links with regular bus services in operation as well as Filton Abbey Wood rail station being within the area.If you are not able to attend a viewing, Grant Property offer live interactive viewings through Skype, Facetime, WhatsApp Video etc to offer flexibility for you to view and secure a property with us.Managed by ARLA registered agent Grant Property with a 24-hour emergency repairs service.EPC rating: C. Landlord Registration Number: Exempt from lr in England. Letting Agent Registration Number: 1903114.",https://www.zoopla.co.uk/to-rent/details/53426792?utm_source=v1:5rrMAiKeXRaB5B66ZOF-pGGnegU4wb2L&utm_medium=api,2019-11-22 18:02:27,0,furnished,51.499943,53426792,-2.568291,1,4,0,BS7,Terrace,2300,0,1,0,575.0
0.0,"This striking double-bay fronted 1930s property is recently renovated, providing a modern home. Upon entering the property, you are greeted by an expansive hallway which leads on to the first double-bedroom. Further along the hallway is the living room which boasts views of the garden beyond. The modern kitchen is also found on the ground floor and is finished to a high standard with glossy cupboards and granite effect worktops. To the first floor there are three additional double-bedrooms all of which are flooded with light through large windows. On this floor there is also the bathroom which includes a three-piece suite which carries on the modern theme found throughout with chrome fixtures and fittings. This property also benefits from free on-street parking available at the front of the property and a multi-level garden offering green space and patio.This property occupies a prime location within the desirable area of Eastville. Located in between the University of Bristol and the University of the West of England, this property is in a perfect location for students. There is excellent transport links which provide ease of access to both the universities and the City Centre, and the popular Eastgate Retail Park is also less than a mile away from Muller road.If you are not able to attend a viewing, Grant Property offer live interactive viewings through Skype, Facetime, Whatsapp Video etc to offer flexibility for you to view and secure a property with us.Managed by ARLA registered agent Grant Property which has a 24-hour emergency repairs service.EPC rating: C. Landlord Registration Number: Exempt from lr in England. Letting Agent Registration Number: 1903114.",https://www.zoopla.co.uk/to-rent/details/53713972?utm_source=v1:5rrMAiKeXRaB5B66ZOF-pGGnegU4wb2L&utm_medium=api,2019-12-13 12:27:49,0,furnished,51.480118,53713972,-2.5754900000000003,1,4,0,BS7,Terrace,2300,0,1,0,575.0
0.0,"Well presented furnished student five double bedroom house with two bath/shower rooms & wc's. The Property Outlet are keen to offer this large victorian terraced house to the student rental market. The accommodation comprises entrance hall, living room(bedroom), separate dining room(bedroom), kitchen/diner & a refitted bath/shower room & WC. The first floor consists of a further three double bedrooms & a bath/shower room & WC. White goods include a fridge/freezer, electric cooker & washing machine. Benefits include gas central heating & double glazing. Close to bus stops for transport to the City Centre & uwe. Sorry no pets.Holding deposit 530.76Bath/Shower Room & WCBath/Shower Room & WC - 2ndBedroom 1Bedroom 2Bedroom 3Dining Room (Bedroom 4)Entrance HallFirst Floor LandingFront GardenKitchen/Dining RoomLiving Room (Bedroom 5)Rear Garden",https://www.zoopla.co.uk/to-rent/details/53608274?utm_source=v1:5rrMAiKeXRaB5B66ZOF-pGGnegU4wb2L&utm_medium=api,2019-12-05 01:05:06,0,furnished,51.49651,53608274,-2.57947,0,5,0,BS7,Terrace,2300,0,1,1,460.0
0.0,"Furnished six bedroom student property ! The Property Outlet are delighted to offer this property which is set over 3 floors & includes 2 bath/shower rooms & WC, kitchen/diner & lounge. White goods include a cooker, fridge, freezer & washing machine. Other benefits include gas central heating & courtyard garden with shed. Close to local amenities, bars, restaurants & cafes on Gloucester Road, horfield sports centre & public transport. Good access for uwe, city centre & M4/5 & M32 networks. Sorry no pets.Holding deposit 530.76Entrance HallLoungeKitchen/DinerBedroom 1First Floor LandingBedroom 2Bedroom 3Bedroom 4Bedroom 5Bedroom 6Bath/Shower Room & WC2nd Bath/Shower Room & WCRear Courtyard Garden",https://www.zoopla.co.uk/to-rent/details/53416811?utm_source=v1:5rrMAiKeXRaB5B66ZOF-pGGnegU4wb2L&utm_medium=api,2019-11-22 03:35:33,0,furnished,51.487415000000006,53416811,-2.583805,0,6,0,BS7,Terrace,2300,0,1,0,383.0
0.0,"***student property***Spacious five double bedroom House in St Andrews, offered fully furnished and available from the 7th of July 2019.The house is located just off Sefton Park Road and has great access to Gloucester Road and Ashley Down Road. Amenities and public transport links are within a five minute walk and it is also a stones throw from St Andrews Park.The accommodation briefly comprises of an open plan kitchen/living room with leather sofas and white goods included, five double bedrooms all furnished as study rooms, a clean bathroom with a shower over the bath and a large back garden.The property also benefits from gas central heating, double glazing, a combination boiler and a conservatory.What you will like:- Great location, - Five double bedrooms, - Good access to Gloucester Road and amenities, - Close to public transport links to the City Centre, - A short walk from St Andrews Park.What you may not like:- This is a student property and professional tenants will not be considered, - Tenants with pets will not be accepted in this house.",https://www.zoopla.co.uk/to-rent/details/49620745?utm_source=v1:5rrMAiKeXRaB5B66ZOF-pGGnegU4wb2L&utm_medium=api,2018-11-06 19:05:42,0,furnished,51.47498,49620745,-2.585403,1,5,1,BS7,Terrace,2250,0,1,1,450.0
0.0,"Furnished six bedroom student property ! The Property Outlet are delighted to offer to the student rental market this spacious victorian style home. The accommodation is set over three floors and comprises entrance hall, living room, bath/shower room & WC, shower room, separate WC & kitchen/diner with electric cooker, fridge/freezer & washing machine. Other benefits include gas central heating and low maintenance gardens. Close to local amenities, bars, restaurants & cafes on Gloucester Road, horfield sports centre & public transport. Good access for uwe, city centre & M4/5 & M32 networks. Sorry no pets.Holding deposit 519.23Bath/Shower Room and WCBedroom 1Bedroom 2Bedroom 3Bedroom 4Bedroom 5Bedroom 6BedroomsEnclosed Rear GardenEntrance HallFirst Floor LandingKitchen/DinerLoungeSeparate WCShower Room and WC",https://www.zoopla.co.uk/to-rent/details/53416810?utm_source=v1:5rrMAiKeXRaB5B66ZOF-pGGnegU4wb2L&utm_medium=api,2019-11-22 03:35:33,0,furnished,51.49061,53416810,-2.581815,0,6,0,BS7,Terrace,2250,0,1,1,375.0
0.0,"***student property***Well presented five double bedroom student house in a cul de sac just of Ashley Down Road, offered fully furnished and available from the 20th of July 2019.The house is located just off Ashley Down Road and is well situated for access to Gloucester Road and plenty of amenities as well as St Andrews Park and public transport links to both the City Centre and uwe.The accommodation briefly comprises of an open plan living room/kitchen that comes with white goods and offers access in to the back garden, five double bedrooms each of a good size and all fully furnished including desks and a bathroom with a shower over the bath.The property also benefits from a conservatory, double glazing, gas central heating and a large back garden.What you will like:- Great location for access to Gloucester Road, - Close to public transport links to uwe and the City Centre, - Five double bedrooms, - Fully fitted kitchen, - Conservatory space, - Open plan living space, - Close to amenities.What you may not like:- The house is only available to students, - Pets will not be accepted in this house.",https://www.zoopla.co.uk/to-rent/details/49620684?utm_source=v1:5rrMAiKeXRaB5B66ZOF-pGGnegU4wb2L&utm_medium=api,2018-11-06 19:05:42,0,furnished,51.475494,49620684,-2.581177,1,5,1,BS7,Terrace,2250,0,1,1,450.0
0.0,"This impressive 1930’s terraced property, located in the heart of the popular Horfield area of Bristol. Upon entering the property you are greeted by a spacious hallway which leads to the light filled bay-fronted double bedroom. Further along is the open plan living area which adjoins the modern kitchen which features quality appliances glossy cupboards. To the first floor there are three further bright double bedrooms and the three-piece bathroom which is finished to a high standard with chrome fixtures and finishes. This property also benefits from free on-street parking and a private garden.Located desirably close to the City Centre and University of the West of England, this property occupies a prime location within the Horfield area. Horfield hosts a number of amenities including eateries, shops and cafes in abundance. Being located just a mile from Southmead Hospital and two miles from the University of the West of England, Horfield is perfectly placed for both students and medical professionals. This property is located just off Gloucester Road which is famous for the abundance of independent shops it hosts. Horfield also benefits from excellent transport including bus links to the City Centre and University of West of England.Managed by ARLA registered agent Grant Property which has a 24-hour emergency repairs service.**If you are not able to attend a viewing, Grant Property offer live interactive viewings through Skype, Facetime, Whatsapp Video etc to offer flexibility for you to view and secure a property with us.EPC rating: C. Landlord Registration Number: Exempt from lr in England. Letting Agent Registration Number: 1903114.",https://www.zoopla.co.uk/to-rent/details/53713981?utm_source=v1:5rrMAiKeXRaB5B66ZOF-pGGnegU4wb2L&utm_medium=api,2019-12-13 12:27:50,0,furnished,51.49496,53713981,-2.577636,1,4,0,BS7,Terrace,2230,0,1,0,558.0
0.0,"This property is located in the popular area of Horfield. It comprises of four double bedrooms, a bright lounge, separate kitchen area and bathroom with shower.Located to the north of Bristol, Horfield is a popular area for many types of residents. Horfield is situated a short distance from the University of the West of England as well as being a short driving distance to the University of Bristol making this a prime student location. The area benefits from a multitude of local amenities with many restaurants and shops nearby including numerous supermarkets. Being located near the city centre also allows for easy access to a wider range of facilities within the heart of the city including the Bristol Shopping Quarter. Accessibility into the city is also made convenient from the transport links in the area with regular bus services as well as Filton Abbey Wood rail station being nearby providing quick regular journeys into the city centre.Managed by ARLA registered agent Grant Property with a 24-hour emergency repairs service.If you are not able to attend a viewing, Grant Property offer live interactive viewings through Skype, Facetime, Whatsapp Video etc to offer flexibility for you to view and secure a property with us. EPC rating: C. Landlord Registration Number: Exempt from lr in England. Letting Agent Registration Number: 1903114.",https://www.zoopla.co.uk/to-rent/details/53426707?utm_source=v1:5rrMAiKeXRaB5B66ZOF-pGGnegU4wb2L&utm_medium=api,2019-11-22 18:02:23,0,furnished,51.494659999999996,53426707,-2.577416,1,4,0,BS7,Semi-detached house,2185,0,1,0,546.0
0.0,"A 4 bedroom furnished student maisonette with gas central heating, lounge and communal garden. Walking distance to Gloucester Road - full of shops, bars, clubs and restaurants. EPC rating (E) . Rent £540 pppm/£ 125pppw. Nb As well as paying the rent, you may also be required to make permitted payments relating to utilities/costs. Full details of Tenant Fees can be downloaded from www.bristoldigs.co.uk.Tenancy date 04/07/2020 - 30/06/2021 Prof ref: 2EltonUM",https://www.zoopla.co.uk/to-rent/details/53557420?utm_source=v1:5rrMAiKeXRaB5B66ZOF-pGGnegU4wb2L&utm_medium=api,2019-12-02 15:40:27,0,part_furnished,51.470776,53557420,-2.594132,0,4,0,BS7,Flats,2160,0,1,0,540.0
0.0,"***student property***Good size five double bedroom student house located between Gloucester Road and Filton Avenue. The property comprises: Five double bedrooms; kitchen with gas cooker, fridge/freezer and washing machine; separate lounge; bathroom with bath and shower and rear garden. Available 15th of July 2020",https://www.zoopla.co.uk/to-rent/details/53573249?utm_source=v1:5rrMAiKeXRaB5B66ZOF-pGGnegU4wb2L&utm_medium=api,2019-12-03 12:17:16,0,furnished,51.494479999999996,53573249,-2.577053,1,5,1,BS7,Missing,2125,0,1,0,425.0
0.0,"****no agency fees***student property*** Huge five double bedroom house located just off Gloucester Road offered furnished with white goods and available from the 10th of July 2020.The property is located on Longmead Avenue, just off Gloucester Road just a short walk away from its shops, pubs, bars and cafes.The accommodation comprises of five large double bedrooms, each furnished with double beds, wardrobes and desks with chairs. There is a spacious living/ kitchen area including a fridge freezer and washing machine, sofas and a dining table. A bathroom with a shower over the bath, separate downstairs toilet and a large patio area at the back of this house perfect for BBQs in the summer.The property also benefits from gas central heating, double glazing and ample parking.What you will like:- Five Large Double Bedrooms- Fantastic Location- Fully Furnished- Private Garden- Great location- White goods included- Close to amenities- Easy access to the city centre- Good public transport linkswhat you may not like:- This property is only available to students.",https://www.zoopla.co.uk/to-rent/details/49620803?utm_source=v1:5rrMAiKeXRaB5B66ZOF-pGGnegU4wb2L&utm_medium=api,2019-12-12 17:15:11,0,furnished,51.480827000000005,49620803,-2.590044,1,5,1,BS7,Terrace,2125,0,1,0,425.0
1.0,"***all bills included*** student property*** - Five bedroom terraced house in Horfield offered fully furnished and available to students from the 2nd of September 2019.The property is located on Dovercourt Road offering easy access to the amenities on Gloucester Road, public transport links to Cribbs Causeway and the City Centre and less than a ten minute walk to Horfield Leisure Centre.The house briefly comprises of; five bedrooms, two of which are on the ground floor along with a large open plan kitchen living dining room and three are upstairs, one being a single.The bedrooms are each furnished with a bed, desk, chair, wardrobe and drawers, the living dining area comes with two sofas and a dining table and chairs, the kitchen benefits from plenty of cupboard space, a fridge, separate tall freezer, gas hob and cooker and microwave as well as a washing machine and tumble dryer. Lastly there is bathroom which has a shower cubicle.The property also benefits from storage space, a large sunny back garden, gas central heating, double glazing and on street parking.What you will like:- Five bedrooms- Fully furnished- Flat screen TV- Open plan kitchen/living/dining- Storage- Large garden- Tumble dryer- Gas hob- Easy access to uwe- Public transport links- Walking distance to amenities- Restaurants, pubs and shops nearby- 11 month tenancywhat you may not like:- Only students will be considered for this property",https://www.zoopla.co.uk/to-rent/details/49620783?utm_source=v1:5rrMAiKeXRaB5B66ZOF-pGGnegU4wb2L&utm_medium=api,2018-11-02 18:16:07,0,furnished,51.485752000000005,49620783,-2.575993,1,5,1,BS7,Terrace,2125,0,1,1,425.0
0.0,"***no agency fees***student property*** Huge five double bedroom house situated in a brilliant location on Gloucester Road, offered furnished with white goods and available on the 10th July 2020.The property is located in a great location on Gloucester Road offering great access to local amenities as well as regular bus links to uwe and the University of Bristol. It's also offers regular public transport links to the City Centre via Gloucester Road and Stokes Croft.The accommodation briefly comprises of; a large kitchen/living/ dining area complete with a washing machine and fridge freezer. The kitchen backs onto a raised patio, which is perfect for summer bbq's. There are five good sized bedrooms all furnished with double beds, desks, wardrobes and chest of drawers. There is one bathroom with a shower over the bath and a separate toilet downstairs.The property also benefits from gas central heating and double glazing.What you will like- Good sized bedrooms- Doubles beds- Big communal area- Raised patio in the garden- Great location- Easy access to the city centre- Close to local amenities- Regular bus links to uwe and the University of Bristolwhat you may not like:- This house is only available to students.",https://www.zoopla.co.uk/to-rent/details/49620862?utm_source=v1:5rrMAiKeXRaB5B66ZOF-pGGnegU4wb2L&utm_medium=api,2019-12-12 17:16:39,0,furnished,51.488388,49620862,-2.5851,2,5,1,BS7,Terrace,2125,0,1,0,425.0
0.0,"Student property - furnished 5 double bedroom house with parking. The Property Outlet are delighted to offer this large victorian terraced house. The accommodation comprises entrance hall, two double bedrooms, lounge/dining room, fitted kitchen and a cloakroom/WC. The first floor consists of three bedrooms and a bath/shower room & WC. White goods include, washer/dryer, fridge/freezer, electric oven/hob & dishwasher. Benefits include gas central heating & part double glazing. Is in a great location for students at uwe. Close to bus stops for transport to the City Centre & uwe. Sorry, no pets.Holding deposit 484.61* Off Road Parking x 2 To RearBath/Shower Room & WCBedroom 1 :DoubleBedroom 2:DoubleBedroom 3:DoubleBedroom 4:DoubleBedroom 5:DoubleCloakroom & WCKitchenLounge/Dining Room",https://www.zoopla.co.uk/to-rent/details/53416809?utm_source=v1:5rrMAiKeXRaB5B66ZOF-pGGnegU4wb2L&utm_medium=api,2019-11-22 03:35:33,0,furnished,51.496864,53416809,-2.57995,0,5,0,BS7,Terrace,2100,0,1,1,420.0
